{
  "$schema": "Sequence.json",
  "name": "hello-webapp",
  "title": "Deploy Your First Web App to Azure",
  "description": "Sample project for Azure Web App with Application Insights resource connection. By running the sample, you will have an example of deploying project to Azure Web App.",
  "repository": "https://github.com/spring-guides/gs-spring-boot.git",
  "context": {
    "subscriptionId": "",
    "accountConfig": {
      "$ref": "AccountConfig.json"
    },
    "webAppConfig": {
      "$ref": "WebAppConfig.json"
    }
  },
  "phases": [
    {
      "title": "Sign-in",
      "description": "Sign in with your Azure account",
      "steps": [
        {
          "title": "Sign-in",
          "description": null,
          "task": {
            "name": "task.signin",
            "paramMapping": {
              "accountConfig": "context.accountConfig"
            }
          }
        },
        {
          "title": "Select Subscription",
          "description": null,
          "task": {
            "name": "task.select_subscription",
            "resultMapping": {
              "subscriptionId": "context.subscriptionId"
            }
          }
        }
      ]
    },
    {
      "title": "Prepare",
      "description": "Prepare dependent resources",
      "help": "./resources/aa_bb",
      "steps": [
        {
          "title": "Create web app",
          "description": null,
          "input": {
            "name": "input.webapp.name",
            "paramMapping": {
              "subscriptionId": "context.subscriptionId"
            },
            "resultMapping": {
              "webappName": "context.webAppConfig.name"
            }
          },
          "task": {
            "name": "task.webapp.create",
            "paramMapping": {
              "webAppConfig": "context.webAppConfig"
            }
          }
        },
        {
          "title": "Create application insight app",
          "description": null,
          "task": {
            "name": "task.application_insights.create"
          }
        }
      ]
    },
    {
      "title": "Build & Deploy",
      "description": "Build artifacts, prepare dependent resources and deploy to Azure Web App",
      "steps": [
        {
          "title": "Build Artifact",
          "description": null,
          "task": {
            "name": "task.webapp.build"
          }
        },
        {
          "title": "Deploy",
          "description": "Deploy to Azure Web App ${context.webapp.name}",
          "task": {
            "name": "task.webapp.deploy"
          }
        }
      ]
    },
    {
      "title": "Done",
      "type": "summary",
      "description": "Your project has been deployed to Aure Web App, enjoy your Azure experience!",
      "steps": [
        {
          "title": "open your web app in browser",
          "description": null,
          "task": {
            "name": "task.resource.open_in_portal"
          }
        },
        {
          "title": "clean up resources",
          "description": null,
          "task": {
            "name": "task.resource.clean_up"
          }
        }
      ]
    }
  ]
}